id,star_rating,location,datetime,content,reviewYear,reviewYearMonth,rating
6079d976f85d750658c781a8,4 stars: Great,GB,2021-04-16 18:37:42+00:00,"The pumps are amazing                                    The pumps are amazing! What a fantastic design. It allows me to express whilst still being able to move around. You do however have to be cautious and i’m not able to lean forward whilst the pumps are on because it does spill the milk, but otherwise they’re fab! We had a slight problem with one of the shields which had become slightly misshapen (likely due to washing them in water that was too hot), but elvie were more than happen to send out a new pair!! Fab customer service!",2021,2021-04,4
6079b6c7f85d750920238a10,2 stars: Poor,GB,2021-04-16 16:09:43+00:00,I having had much luck expressing with…                                    I havent had much luck expressing with this machine.,2021,2021-04,2
6079ac37f85d750920237c86,5 stars: Excellent,US,2021-04-16 15:24:39+00:00,Amazing service                                    Amazing service. Called with concerns with one of my pumps not working properly. They sent a new one within a couple days. Very easy and great customer service.,2021,2021-04,5
607984d7f85d750870609ccf,5 stars: Excellent,US,2021-04-16 12:36:39+00:00,"Great customer service                                    Great customer service, prompt communication and reliable warranty!  My pumps had been leaking over the course of a few months.  After trying out multiple suggestions (per the Elvie team) with failed attempts, they sent me replacement parts within days! The pump suction feels stronger and they haven’t leaked since!",2021,2021-04,5
60797b51f85d7508706084d8,5 stars: Excellent,US,2021-04-16 11:56:01+00:00,"Excellent customer service                                    Excellent customer service. One of my pumps started making a high-pitched “squeaking” noise that persisted after through cleaning and replacement of / changing of parts. Suction was lackluster. I emailed an Elvie representative and they shipped me a new hub right away. I am so impressed with this company, and have (and will continue to!) referred this company and their pump to all of my breastfeeding Mama friends. Thank you, Elvie!",2021,2021-04,5
6078f688f85d7508705fb716,5 stars: Excellent,US,2021-04-16 02:29:28+00:00,"Product is as advertised                                    Product is as advertised. The Elvie does leak leaning forward. I had issues with my Elvie, one made a clicking noise, another just died with no battery light - unable to charge. In both cases, Elvie responded quickly, directly, and resolved the issue succinctly. I got a new hub and flanges. Although the product is expensive, the company stands by its warranty earning my trust.",2021,2021-04,5
6078c937f85d7508705f9df3,5 stars: Excellent,AU,2021-04-15 23:16:07+00:00,Elvie were so quick to respond to my…                                    Elvie were so quick to respond to my enquiry and then to provide the support and parts I needed. I cannot rate their customer service and subsequent prompt delivery of a solution highly enough. Thank you!,2021,2021-04,5
6078ad46f85d7508705f7ffd,3 stars: Average,US,2021-04-15 21:16:54+00:00,"Should be said                                    I feel, that the instructions for sanitizing in the booklet should be changed so that no one unintentionally warp the washable parts. I also, feel that it should be said that they may not work well with the heavier chested population and those who have elastic nipples. As well as make it more clearly known that a pump can not be returned.",2021,2021-04,3
6078a360f85d7508705f700b,1 star: Bad,US,2021-04-15 20:34:40+00:00,"Ongoing issue                                    Very responsive however my concern was not addressed with a quick enough solution for an issue due to a faulty part on a replaced hub, ultimately affecting my milk supply further.",2021,2021-04,1
6078a127f85d7508705f6bef,5 stars: Excellent,US,2021-04-15 20:25:11+00:00,I really love this brand BECAUSE of the…                                    I really love this brand BECAUSE of the convenience and the customer service. I have had a few issues with my pumps but when I contact customer service they are 100% on top of making sure that I am taken care of and my pumps get into working order.,2021,2021-04,5
60789d54f85d7508705f647b,5 stars: Excellent,US,2021-04-15 20:08:52+00:00,Great customer service                                    Fast service when I had an issue. Shipping was 2 days and I had replacement parts at no charge,2021,2021-04,5
60789c0af85d7508705f61e7,5 stars: Excellent,US,2021-04-15 20:03:22+00:00,Awesome customer service and product                                    So happy with the freedom my Elvie pumps provide and blown away by their customer service. Helped me troubleshoot my issue fast and effectively.,2021,2021-04,5
607750f8f85d7508705d1053,1 star: Bad,US,2021-04-14 20:30:48+00:00,Unfortunately it has many issues                                    Nice idea but way too many flaws and issues. I would pay a lot of money for this item-if it worked. Suction is terrible and weak and you get very little milk compared to when you connect to a regular pump like Spectra. You don’t know if the breast is empty. Battery lasts for only one session. YOU HAVE TO RECHARGE EACH TIME! It leaks if you walk around or incline in any way. You’re not as mobile as you think since everything leaks if you move too much therefore wasting precious milk. You won’t know how much you’ve pumped. The numbers for the output on the app are estimates and often incorrect. You can't see the liquid in the bottle unless you take it off. The app disconnects every time you use it. It’s a horrible product- for this price and any price. You think it would be great to pump and be mobile- yes it would be but this product doesn’t accomplish that.,2021,2021-04,1
6075deebf85d7508705a74c4,5 stars: Excellent,US,2021-04-13 18:11:55+00:00,"Customer service was always very…                                    Customer service was always very helpful. Worked with them awhile, got several replacement parts in the mail to try.",2021,2021-04,5
6075d197f85d7508705a5243,5 stars: Excellent,US,2021-04-13 17:15:03+00:00,Items received timely and as ordered                                    Items received timely and as ordered.  Pump works great so far and is super convenient.,2021,2021-04,5
6075bf99f85d7508705a1bd5,4 stars: Great,GB,2021-04-13 15:58:17+00:00,"Single pump: good device, service needs a few improvements                                    I have found my Elvie pump to be very helpful in managing breastfeeding my 5 week old. However, the following are areas for improvement:1) The packaging of the pump should be more environmentally friendly and easier to recycle.2) A service should be offered to measure nipple size for the breast shield prior to purchase or soon after so that two shields of the desired size could be sent rather than sending a shield of a size that does not suit.3) It would be better if the additional items you could purchase could add up to sets. The single pump came with two bottles but one shield - to avoid having to wash the shield more often than the bottles, I purchase the additional shield pack. However, this means I have three shields but two bottles. If I wanted to purchase additional bottles, I'd have to buy a pack of three, which would yield me five bottles but three shields (again, a mismatch). I think it would be better to be able to purchase an ""extension pack"" - a matched set of shields and bottles.4) The app is very helpful for keeping track of when I pump and what I get out, but I always have to adjust the amounts because the app never gets the ml from each breast correct - just be warned if you are trying to keep track of amounts per breast!",2021,2021-04,4
6075b34df85d75087059fa3b,5 stars: Excellent,US,2021-04-13 15:05:49+00:00,Great service                                    Great service! Love my new pump!,2021,2021-04,5
6075adebf85d75087059eaf6,5 stars: Excellent,US,2021-04-13 14:42:51+00:00,Very fast shipping                                    Very fast shipping. Easy to order,2021,2021-04,5
6075911ef85d750870599fda,5 stars: Excellent,US,2021-04-13 12:39:58+00:00,Thank you!                                    My Elvies started leaking and I couldn’t figure out why. So I reached out to Elvie’s customer support regarding my issue & they responded very quickly & gave me a list of issues to troubleshoot. Once I provided proof of purchase they were able to send me replacement valves in and I haven’t had a leaking issue ever since. Thank you Elvie <3,2021,2021-04,5
60757392f85d750870595324,5 stars: Excellent,US,2021-04-13 10:33:54+00:00,"Easy to talk to, quick response                                    Easy to talk to, quick response, fast delivery, all around great experience! Both with customer service and with the product!",2021,2021-04,5
60752f17f85d75087058cfc7,5 stars: Excellent,ZA,2021-04-13 05:41:43+00:00,Great after market support.,2021,2021-04,5
6074ea9cf85d75087058abfe,3 stars: Average,US,2021-04-13 00:49:32+00:00,I’ve had some issues with the pumps but…                                    I’ve had some issues with the pumps but customer service is excellent,2021,2021-04,3
6074c27df85d750870588f60,5 stars: Excellent,US,2021-04-12 21:58:21+00:00,Worth every penny                                    Have the mobility has been a game changer in my breast pumping journey.,2021,2021-04,5
6074c146f85d750870588e06,3 stars: Average,US,2021-04-12 21:53:10+00:00,Leaks a lot and the suction is good…                                    Leaks a lot and the suction is good only 60% of time,2021,2021-04,3
6074ba95f85d75087058858a,1 star: Bad,US,2021-04-12 21:24:37+00:00,"Terrible customer service                                    Awesome product, terrible customer service.",2021,2021-04,1
6074b6daf85d750870588040,5 stars: Excellent,US,2021-04-12 21:08:42+00:00,I had an issue with my pump not…                                    I had an issue with my pump not charging and the other suction seemed weak. I called customer service and they were helpful and sent an email with troubleshooting instructions. They both are back to working again!,2021,2021-04,5
6074a41cf85d750870585ffe,5 stars: Excellent,US,2021-04-12 19:48:44+00:00,It was super easy to purchase from the…                                    It was super easy to purchase from the website and the item came at a timely manner.,2021,2021-04,5
6074a1fdf85d750870585b59,4 stars: Great,US,2021-04-12 19:39:41+00:00,"Although this product saves much time                                    Although this product saves much time, some of the parts were easily warped when sterilizing. I would recommend this product to others, but notify them about the cons of purchasing the product.",2021,2021-04,4
60749c68f85d750870584f05,5 stars: Excellent,US,2021-04-12 19:15:52+00:00,"I swear in Elvie pump                                    I swear in Elvie pump. I can't imagine a day without it since I am exclusively pumper. Just put it in the bra and do whatever I want. Small, quite. Customer servise was extremely kind regarding fo help. I needed new breastshield and I had it two days after I spoke with them. I give to Elvie pump and Elvie team 5 stars!!! Thank you for this wonderful product which make my life easier. 🙏",2021,2021-04,5
60749c23f85d750870584e69,5 stars: Excellent,AU,2021-04-12 19:14:43+00:00,"Approachable website and good delivery                                    The website is easy to use, clear to see the different products, their applications but it took a bit of to-and-fro to really work out the differences, and the criteria on which I might make a choice between the pumps, for example. They were delivered as promised and all well packed in good order. More than that I can't say as I bought them for my daughter and have sent them to her on the other side of the world ... where they are yet to arrive and be tested.",2021,2021-04,5
60749160f85d75087058354c,5 stars: Excellent,US,2021-04-12 18:28:48+00:00,Easy to purchase                                    Easy to purchasequick shippinggreat product i use my shields all the time they are compact and really dont shift around never had a leak,2021,2021-04,5
60748e99f85d750870582e6a,5 stars: Excellent,US,2021-04-12 18:16:57+00:00,This was the best decision I made                                    This was the best decision I made! It is a game changer! The entire process was easy and fast.,2021,2021-04,5
6074892af85d750870582112,5 stars: Excellent,US,2021-04-12 17:53:46+00:00,Quick shipping  and amazing customer…                                    Quick shipping  and amazing customer service. Love my pumps easy to use so quiet I can wear while at work.,2021,2021-04,5
607485f0f85d750870581976,5 stars: Excellent,US,2021-04-12 17:40:00+00:00,"Fast shipping and easy to use.                                    Easy to order online. Arrived much faster than I thought it would. Packaging was in excellent condition. Very easy to use and clean. Glad that suction portion came with two nipple sizes. The app is very easy to use. I only wish the timer alert on the app was a bit louder and that it was easy to go back to a session if it was accidentally ended too quickly instead of restarting a new session. Overall, very happy with this purchase and I would recommend it to others. The only thing that would make it better is if there was a system in place to directly pump into freezer bags.",2021,2021-04,5
6074832ef85d7508705812ca,1 star: Bad,US,2021-04-12 17:28:14+00:00,"Horrible product and horrible customer service                                    Horrible product and horrible customer service. So dissatisfied !!! I wasn’t able to pump any milk from my Elvie, but got so much with my Spectra S1. Elvie would not give me a refund! What a scam!",2021,2021-04,1
607482dff85d7508705811fe,1 star: Bad,US,2021-04-12 17:26:55+00:00,"Still no resolution                                    Still no resolution. I have a broken pump and am told to wait for a part while Elvie is able to still sell new pumps. I can presume that the parts exist for OEM but warranty matters are not being handled. Cannot recommend you as a company in good faith anymore. Over a month without resolution is unacceptable for a breast pump, a medical device used several times daily.",2021,2021-04,1
60748041f85d750870580b28,5 stars: Excellent,US,2021-04-12 17:15:45+00:00,"I can not recommend enough!!                                    I can not recommend enough the Elvie Curve. Its a wonderful little (discrete) gadget to build a stash when breastfeeding. My baby is almost 2 months old, i already have a mini freezer worth of milk just using this little pump collecting the milk of the other boob while breastfeeding my baby. I have not used my breast pump once. It also really help keep the flow of milk and avoid mastitis. Its also incredibly ergonomic making it a better option than the haakaa and worth the significant higher price. Though I do wish it was a bit more affordable.Really recommend this this product. The shipping was fast and easy.",2021,2021-04,5
60747a6bf85d75087057fb9f,4 stars: Great,US,2021-04-12 16:50:51+00:00,"Pump issues/resolution                                    Customer service so far has meant follow along to pictures/ video  to see what’s wrong with suction on my pumps. It’s been helpful a few times now. Overall I don’t think he Elvie pump works as well as my lansinoh pump. I never seem to get as much milk with the Elvie, but it is very handy when I am busy driving, working or feeding a bottle to my baby to have the option to pump without the cords. Overall I’m happy with it.",2021,2021-04,4
607478b2f85d75087057f710,5 stars: Excellent,US,2021-04-12 16:43:30+00:00,The Elvie is awesome                                    The Elvie is awesome! As a physician working in the OR’s I’m always on the go so having a hands free pump makes a world of difference. I was worried about the suction but it’s proven to be just as good as my spectra and is pretty easy to put on. It def makes your chest more bulky so I try to still stay in my office when pumping but can throw on a jacket to kind of hide my chest. Overall great and I would recommend!,2021,2021-04,5
607477cff85d75087057f4a9,4 stars: Great,US,2021-04-12 16:39:43+00:00,Overal amazing product and company. …                                    Sometimes the Elvie leaks even when they aren’t full and soak my bra and shirt. The customer service is exceptional! A usb cord wasn’t working and they immediately responded to my email and sent two new cords to me at no charge !,2021,2021-04,4
60747672f85d75087057f0b7,1 star: Bad,US,2021-04-12 16:33:54+00:00,Never received the order                                    Ordered the Elvie trainer. Received an email stating they were out of stock and they didn't know when it would be back in stock. I expected better customer service.  I canceled the order and ended up purchasing another product.,2021,2021-04,1
6074763bf85d75087057f021,3 stars: Average,GT,2021-04-12 16:32:59+00:00,"I have two elvie pumps I love them but...                                    I have two elvie pumpsI love them, they make breastfeeding so much practical for a working mom! the only reason is that one of them is starting to do a weird thing when charging... the first 10-15 minutes the light goes on and off along with a click sound. The did not happened in the beginning and I have only use it for about two months. Maybe just mine have this weird thing? otherwise I love them!",2021,2021-04,3
607474c4f85d75087057ec09,5 stars: Excellent,US,2021-04-12 16:26:44+00:00,"Very professional and timely                                    Very attentive, professional and organized!",2021,2021-04,5
6074746ef85d75087057eb04,5 stars: Excellent,US,2021-04-12 16:25:18+00:00,"Silvana provided excellent customer…                                    Silvana provided excellent customer service. She provided me with the support I needed, was kind and pleasant, and showed compassion when i shared the needs I had. She also gave me next steps in order to ensure my products last through a different sterilization procedure.",2021,2021-04,5
607473d0f85d75087057e930,2 stars: Poor,US,2021-04-12 16:22:40+00:00,"Not Worth The Money                                    It lost its suction after a couple of uses and when I went walking with it just for a stroll around the neighborhood (which I thought I could do), it had a major leaking problem. I feel like I have to be “still” (not moving) in order to wear this which to me loses its value for why I bought it.",2021,2021-04,2
607470e3f85d75087057e118,1 star: Bad,US,2021-04-12 16:10:11+00:00,Disappointed                                    I was so excited to purchase the Elvie since I am exclusively pumping and it is very difficult to do things while hooked up to a machine. However I have had nothing but trouble with the product since day one. I cannot get the thing to suction properly even after customer service has sent me multiple replacement parts. I’ve had it for almost a month and have yet to be able to use it. It has been a lot of work constantly troubleshooting especially while having a newborn. Needless to say I’m extremely disappointed but im even more dissatisfied because the company won’t refund me for their unusable product. So now I’m out over $400 and stuck with a pump I can’t use.,2021,2021-04,1
6074707af85d75087057dfda,5 stars: Excellent,US,2021-04-12 16:08:26+00:00,"The website was easy to maneuver                                    The website was easy to maneuver, very informative, and checkout was easy. Didn't need customer service so I can't rate on that but everything else was great. Can't wait to use the pump after my son arrives.",2021,2021-04,5
6074704ff85d75087057df58,5 stars: Excellent,US,2021-04-12 16:07:43+00:00,I couldn't have been happier with the…                                    I couldn't have been happier with the fast response. I tried all the steps provided to me to try to troubleshoot my device. Overall I am 100% satisfied with the level of care and would love doing business with elvie again.,2021,2021-04,5
60747028f85d75087057dee8,5 stars: Excellent,US,2021-04-12 16:07:04+00:00,"Very responsive and helpful                                    The two Elvie hubs died on me, customer service quickly sent me two replacements right away. They were prompt and helpful!",2021,2021-04,5
607467f8f85d75087057c6d0,5 stars: Excellent,GB,2021-04-12 15:32:08+00:00,Elvie Pump                                    Haven’t used it yet however delivery was very quick and easy and we managed to get it with a little money knocked off over Mother’s Day too!,2021,2021-04,5
6074676df85d75087057c539,5 stars: Excellent,GB,2021-04-12 15:29:49+00:00,Excellent                                    Excellent. The Elvie breastpump has been a lifesaver! Easy to use and clean. The battery life is a bit on the short side and I find I have the charge the pump once a day. Also a bit bulky in the bra so i wouldn't chose to use it if i am out fir example but it does mean I can get on with other things in the house or breastfeed and pump at the same time. Overall it is great and i am very pleased as it gives me freedom.,2021,2021-04,5
60746735f85d75087057c490,5 stars: Excellent,GB,2021-04-12 15:28:53+00:00,"I absolutely love my elvie                                    I absolutely love my elvie, I’m not going to lie the initial outlay price tag is a bit ouch and I have had to play around a bit to make them work for me (I brought extra 24mm plates so I always had a spare and sometimes I have to construct my pump a few times to ensure a good seal, suction and there’s no wet bits I’ve missed) but I love the fact I can pump anywhere, anytime discreetly and  wouldn’t be without my elvie. The elvie app has been really helpful and although I haven’t set up for remote pumping and milk monitoring the trouble shooting and set up videos are really clear and concise.",2021,2021-04,5
607452e4f85d7508705788e1,5 stars: Excellent,GB,2021-04-12 14:02:12+00:00,"Great Product                                    Great Product, excellent customer service. I knew what was happening and felt in control throughout the entire order/delivery process. Thanks Elvie!",2021,2021-04,5
607452b9f85d75087057886e,2 stars: Poor,GB,2021-04-12 14:01:29+00:00,Battery isn't great and it's a disgrace…                                    Battery isn't great and it's a disgrace I paid 200 ++ and then had to pay a extra 30 for a different size flange. Leaks on me and stops alot,2021,2021-04,2
60744f13f85d750870577d7e,3 stars: Average,GB,2021-04-12 13:45:55+00:00,"Difficult to pour the milk out                                    Difficult to pour the milk out, every drop counts but unable to get the last drops out, approximately 5ml. Unable to see the milk pouring into the container and the app is sometimes inaccurate. Preferably mums need to see when their milk stops flowing.",2021,2021-04,3
60744e6ef85d750870577b6f,1 star: Bad,GB,2021-04-12 13:43:10+00:00,"It’s just breaks.                                    I bought this for my sister, after her first one broke. 1 week later the second has now also broken and no one is willing to refund it. The product clearly has faults and yet you won’t repay customers.",2021,2021-04,1
60744d09f85d7508705776cc,5 stars: Excellent,GB,2021-04-12 13:37:13+00:00,Good service                                    Fast delivery when replacing defective part,2021,2021-04,5
60744ba7f85d750870577274,5 stars: Excellent,GB,2021-04-12 13:31:19+00:00,Brilliant product                                    I was a little worried as reviews seem to be super positive or super negative. But I wasn’t doing well with a hand pump so decided to give it a go! I’d 100% recommend it to anyone! It’s absolutely brilliant and a complete game changer. I mostly use it when driving places and it’s so quick and easy!,2021,2021-04,5
60744b72f85d7508705771c5,5 stars: Excellent,GB,2021-04-12 13:30:26+00:00,Easy to order and arrived quickly.,2021,2021-04,5
606da28af85d7508704d4845,1 star: Bad,GB,2021-04-07 12:16:10+00:00,"Good idea but ultimately a poor product.                                    I brought and Elvie in February as I wanted more freedom when expressing. Since then I’ve had 2 replacement Hubs and endless emails to customer services. Expressing is the only way I can feed my newborn, the pump has so many flaws; it leaks (through my bra and top), the suction is weak - leaving my breast still full after a 12 min pump and one of them would cut out mid pump and not turn back on. The worse thing was the emotion stress and anxiety this pump has caused me. Every Pump became a stressful experience as I had to manage my way through the faults and the lack of suction affected my flow.I hired the hospital grade pump for 2 months at the start and wish I just kept using that, it was so efficient, I use to get loads of milk within 7mins. Since using the Elvie my milk production as reduced and I express for longer. It’s gotten to a point where if I don’t re-hire the hospital grade pump, my milk supply will be affected and I will be forced to use formula. Based on this experience, sadly I would not recommend the Elvie, it’s expensive and does not do the job, spend/invest your £250 elsewhere. Such a shame because it’s a good idea and on the occasions it did work, it was great but overall the product did not deliver and caused too much stress.",2021,2021-04,1
