id,star_rating,location,datetime,content,reviewYear,reviewYearMonth,rating
5fdb7a16755dc10b4826250e,4 stars: Great,GB,2020-12-17 15:32:38+00:00,"Blocked ducts but excellent customer service                                    The feature of having a hands free portable pump is an excellent idea and it was why I chose to purchase this pump to begin with.Delivery was excellent and product appears to be of high quality and well manufactured. However, on starting using the pump I developed for the first time recurrent painful blocked ducts. I initially thought it was the size of the flange so I ordered the smaller one but symptoms persisted. Ironically I was using it more often to clear the blockage but it was getting worse. GP prescribed antibiotics for mastitis.I am not sure whether it is the design of the flange being more flat than other pumps but essentially it did not work for me at all.The reason I am giving 4 stars is because of the extremely helpful and supportive customer service, which to my opinion makes all the difference in any product. I informed the team of the said problems and they were willing to help from the beginning. They replied to all my emails in a timely fashion and they accepted to return and refund the product. I am currently waiting for the refund. Extremely professional and high quality customer service.",2020,2020-12,4
5fdb79bc755dc107e0c671d4,5 stars: Excellent,GB,2020-12-17 15:31:08+00:00,Excellent customer service,2020,2020-12,5
5fdb77c8755dc107e0c66ec1,3 stars: Average,GB,2020-12-17 15:22:48+00:00,"Mixed feelings                                    My experience with the Elvie pump was a mixed one. The idea for a quiet, discreet, hands-free pump is great, and using the Elvie meant that I was able to work away from home, pump in public places (such as cafes) and share the feeds with my partner. On the other hand, I experienced multiple, repeated issues with parts of the pump warping and breaking, and I found that the pump only really worked efficiently at times when I had a very full milk supply. On almost every occasion when I contacted the customer service team for advice, I found them very helpful and able to suggest things to try that alleviated (but didn't entirely fix) the various problems. But now that I am expecting another baby I am planning to invest in a new pump. Overall, despite its plus points, I'm afraid I found the Elvie too unreliable for me to consider using it on a regular basis again.",2020,2020-12,3
5fdb755a755dc107e0c66aef,5 stars: Excellent,US,2020-12-17 15:12:26+00:00,I had issues with my Curve                                    I had issues with my Curve and contacted customer service. They saw that mine had a defect and they sent me one the following day. Amazing customer service,2020,2020-12,5
5fdb7536755dc10b48261d84,1 star: Bad,GB,2020-12-17 15:11:50+00:00,The suction on this pump is not very…                                    The suction on this pump is not very strong and it always leaks,2020,2020-12,1
5fdb7314755dc107e0c6677c,4 stars: Great,GB,2020-12-17 15:02:44+00:00,Good tool                                    Good tool. Some more variation in the exercises would be nice but overall it is very clever.,2020,2020-12,4
5fdb72fe755dc107e0c66756,1 star: Bad,SA,2020-12-17 15:02:22+00:00,One of the pumps does bot work well,2020,2020-12,1
5fdb7261755dc107e0c6667b,5 stars: Excellent,GB,2020-12-17 14:59:45+00:00,The best breast pumps out there!                                    I bought Elvie in preparation for my 2nd child.I knew from previous experience how hard breast feeding was and I wasn't successful last time for various reasons.When I had my baby in March again I struggled to feed but I didn't worry myself this time I just started using my Elvie and I'm so glad I did!I used it from day 1 until my baby was 8 months old exclusively expressing and although I had times where my body wasn't producing much milk I perserved. I'm really proud of myself as I didn't think I would manage as long as I did and it's because of Elvie.I would highly recommend Elvie to anyone.I loved how I could use them anywhere discreetly.Thankyou so much.,2020,2020-12,5
5fdb707a755dc107e0c663a0,5 stars: Excellent,GB,2020-12-17 14:51:38+00:00,Brilliant service                                    I was having difficulties with the shields. The customer service was so great. They advised me on the best way to sterilise and sent out some new ones incase I had damaged them.The elvies themselves have been phenomenal. They are the only pump I use and I exclusively pumped for 6 months so they really have been worth every penny.,2020,2020-12,5
5fdb6f12755dc10b4826148f,5 stars: Excellent,GB,2020-12-17 14:45:38+00:00,Best baby buy                                    Got to say this pump is brilliant it has exceeded my expectations and I'm over the moon with it. I've nevee expressed before but it's been fantastic - I'd say possibly my best baby buy.!,2020,2020-12,5
5fdb6d72755dc107e0c65f5c,1 star: Bad,GB,2020-12-17 14:38:42+00:00,"Total waste of money                                    Total waste of money. Since buying it I have used it twice and I am currently using my cheap £15 plug in pump instead as it is simply much better. The suction isn’t strong enough, the collection bottle isn’t big enough and the battery life isn’t long enough.",2020,2020-12,1
5fdb6d60755dc10b48261226,2 stars: Poor,GB,2020-12-17 14:38:24+00:00,The pump is way more overrated then it…                                    The pump is way more overrated then it actually is! Tried all the size shields yet the suction remained crap my milk supply dropped and ended up using the good old wired ones from lansioh.. would I ever spend this type of money in a product like this? No and would I recommend defo no! Although the customer service are brilliant and go out of their way to help! But some things are just not worth such an amount of money,2020,2020-12,2
5fdb6d20755dc107e0c65ee4,5 stars: Excellent,GB,2020-12-17 14:37:20+00:00,"Lifesaver and I wouldn’t be without it                                    Lifesaver and I wouldn’t be without it. I steam sterilised in the microwave which actually buckled a component slightly, it took us ages to work out what it was but elvie CS helped every step of the way and once we understood the issue it’s worked perfectly ever since- great customer service, and a must have pump if you intend to do anything productive whilst you express (or not- it’s quiet enough to watch television whilst using it for amuch needed break). I’d absolutely recommend this",2020,2020-12,5
5fdb6b46755dc10b48260f12,5 stars: Excellent,GB,2020-12-17 14:29:26+00:00,"Life changing                                    I have to say that my purchase through Elvie has been life changing. I’ve since recommended the device to many friends. I cannot sing it’s praises highly enough, I've got my freedom back. The whole experience from purchase to benefiting from it has been seamless, thank you to the geniuses at Elvie!",2020,2020-12,5
5fdb689a755dc107e0c65805,3 stars: Average,GB,2020-12-17 14:18:02+00:00,Disappointing                                    This product has undoubtedly made my life immeasurably easier and helped me to continue to feed my son 100% breast milk when he couldn’t manage it directly. However I have serious reservations about the hygiene and cleanliness of the hubs and have had frequent problems with suction. Customer service has been dire at times when I have really needed it. The company bears a heavy responsibility in its duty of care to its customers - Mums like me are relying on the pumps as their babies’ main or only food source and we simply can’t wait around for a slow response. We don’t spend this amount of money on pumps unless we really need them.,2020,2020-12,3
5fdb6807755dc10b48260a1c,2 stars: Poor,GB,2020-12-17 14:15:35+00:00,"Silicone elvie curve not good for big bust                                    Ordering was straight forward delivery as expected , how ever the elvie curve silicone product is not designed for ladies with a big bust when I put this on and put my bra on it stops the flow of my let down , my nipple touches the wall I bought two of these to help with the mornings as I have an over supply and they are useless and a waste of money , I’m glad I didn’t buy the electric ones as that would have been a huge amount to part with very disappointing",2020,2020-12,2
5fdb66f6755dc107e0c6557e,4 stars: Great,GB,2020-12-17 14:11:02+00:00,"Good idea                                    Good idea. Would be great if they would change some of the games around a bit, perhaps relaxing the PF as parts of the game would be useful too?But impressed with the product & very clean design",2020,2020-12,4
5fdb6690755dc107e0c654d9,5 stars: Excellent,GB,2020-12-17 14:09:20+00:00,One of the best purchases and would…                                    One of the best purchases and would strongly recommend to anyone who wishes to express. Look no further than Elvie!,2020,2020-12,5
5fdb6617755dc107e0c65419,1 star: Bad,GB,2020-12-17 14:07:19+00:00,"Sadly didn’t work out                                    I was very keen to try the Elvie but unfortunately it just didn’t work for me. I’m unsure if other women with a bigger bust have had issues, but the unit didn’t fit snugly against my breast and so there was a lack of suction, meaning I couldn’t pump much. The team were very helpful and tried to resolve the issue but I think the fit just wasn’t right for my body. It’s an awful lot of money to spend on something that just doesn’t work.",2020,2020-12,1
5fdb65e9755dc107e0c653dc,1 star: Bad,GB,2020-12-17 14:06:33+00:00,"Poor customer experience                                    Terrible product. Stopped working after a couple of uses. Customer services were very poor, after what felt like a battle we eventually got a full refund. Very poor customer experience.",2020,2020-12,1
5fdb658b755dc107e0c65351,5 stars: Excellent,GB,2020-12-17 14:04:59+00:00,Excellent!                                    Great product and superb service.,2020,2020-12,5
5fdb6580755dc10b48260617,3 stars: Average,GB,2020-12-17 14:04:48+00:00,"Great for the first few months... buy with your eyes wide open                                    For the first few months, I absolutely LOVED the Elvie pump - it was amazing and really did change my life.It was discreet and I pumped everywhere with no problems (doctor’s appointments, the car, during night feeds). I can see why it gets to many 5* reviews but I wonder if these are left in the excitement of first using it. This is a review from someone who has used it for 11 months and it is not so excited. Don’t get me wrong, I would recommend the Elvie and I’m so glad I bought it but I would recommend it with a lot of warnings. I had enormous problems with the parts becoming misshapen when being sterilised. The very nature of the pump working requires the parts to fit perfectly which they then did not and so I had problems with noise and leakage. This is not an isolated incident. I recommended the Elvie pump to three other friends who all bought it and we all had problems with the parts. For two of us, our hubs even stopped working. Customer services could not be faulted, however and sent me MANY replacement parts (every time they needed replacing, which was fairly often). They were really lovely and posted replacements out quickly. I find it unforgivable that the warranty on the parts is 90 days (an admission of their own low-quality) when most women would aim to give their babies breast milk for at least 6 months.Also, notice how many of these reviews that are 4 and 5* mention customer services giving replacement parts...!To end on some positives, even though I had a lot of problems with my pump, I would not have been able to feed my baby with my milk for as long had I not had the Elvie. I used a Madela Swing for the last month of my pumping and I don’t think I liked it as much. I bought this though as I really feared my Elvie breaking again and having no way to express. I would recommend having a cheaper back-up.My baby had to go into hospital a couple of times in her first couple of weeks and I was able to pump wirelessly at various hospital appointments. The miracle of this cannot be underestimated. Had I not been able to do this, I would have needed to excuse myself for long periods of time to pump or otherwise suffered blockages. I really don’t think I would have been able to give my baby my milk for as long if I had been using any other pump. I didn’t like being plugged into the Madela and I didn’t like the noise. I pumped for 11 months with only switching between the Elvie and the Madela for the last month. Just be realistic and buy it with your eyes open. Be careful when sterilising it. I would not recommend just-boiled water. Also, double check the intensity of the microwave. I REALLY HOPE that Elvie have started to listen to feedback and are improving the quality of their parts and that new parts will still be compatible with the hubs that so many women have invested a lot of money into.",2020,2020-12,3
5fdb6535755dc107e0c652d5,4 stars: Great,GB,2020-12-17 14:03:33+00:00,Product didn’t work for me but good customer service                                    Product didn’t work for me but would work well if you had a good supply.,2020,2020-12,4
5fdb64c4755dc107e0c65211,5 stars: Excellent,GB,2020-12-17 14:01:40+00:00,The most important and amazing purchase…                                    The most important and amazing purchase I’ve made as a second time around mum. It’s convenient and discrete and I love it !,2020,2020-12,5
5fdb6491755dc10b4826049f,3 stars: Average,GB,2020-12-17 14:00:49+00:00,"NOT HAPPY- FOR WHAT WE PAY IS NOT WHAT WE GET                                    I am not quite happy given the price we are paying just for one pump ! I would expect it to work flawless !!! You can find better at lower price , if I knew I wouldn't have come here ! Anyway it works ok. Sometimes it latches properly and you can pump milk while working however the ml extracted is also incorrectly marked ... But most of the time my pump wouldn't pick the sensation and won't start pumping and I ahev guided and fit nipples correctly in the right fling but it just won't work! So I gave up",2020,2020-12,3
5fdb6431755dc10b48260413,5 stars: Excellent,GB,2020-12-17 13:59:13+00:00,Amazing customer service!,2020,2020-12,5
5fdb6393755dc107e0c65027,3 stars: Average,GB,2020-12-17 13:56:35+00:00,"Honest review                                    Cost of elvie is steep. £250 for 1 pump, and lets face it, as a breast feeding mum who pumps you need 2 pumps. Especially if you are tying to increase milk supply, or if your like me, an exclusive pumper.Unfortunately for me I had nothing but problems with my pump. The breast shield cracked, which was replaced. Then the bottles required new parts and they were faulty which caused milk to continously leak - which was infuriating.Despite all of this. The customer service team helped with all of these problems super fast. But was annoying that it occurred in the first place. Especially due to the high cost of the pump to begin with. On the whole, I love the idea of the pump as it means you are hands free and able to move around with ease. Not only that but it is super quiet. It's a good idea but needs to be perfected and there were nothing but issues.Would I buy again? No. I would spend less money on a pump I know to work without issues. Even if it means I'm no longer hands free and have to listen to a noiser pump.Would I recommend to a friend? No. Currently I don't think it's worth the cost. Until its perfected, it's not worth it",2020,2020-12,3
5fdb6334755dc107e0c64f9c,5 stars: Excellent,GB,2020-12-17 13:55:00+00:00,Amazing                                    Amazing a huge help,2020,2020-12,5
5fdb632e755dc10b48260278,4 stars: Great,GB,2020-12-17 13:54:54+00:00,"Good not great                                    As an exclusive pumper, I know I wouldn’t have carried on expressing for as long as I did without the elvie so for that I am grateful. However, it could definitely be better for the price. The concept is great but in my opinion, you can’t be as free as the advertising makes out when using it and it was still very prone to leakages with little movement. It would also often say it was full when it wasn’t. It would be great if it could stop automatically after a set period of time so if you are in public, you don’t have to delve into your bra  or keep checking the app to stop it. On the whole a good product but for the price, I had definitely hoped for a bit more.",2020,2020-12,4
5fdb6311755dc107e0c64f69,1 star: Bad,GB,2020-12-17 13:54:25+00:00,Very disappointed with the Elvie…                                    Very disappointed with the Elvie Curve... It's very unsuitable for bigger breasts as the cup just won't sit properly and doesn't have a hole big enough...,2020,2020-12,1
5fdb62ac755dc107e0c64ec4,5 stars: Excellent,GB,2020-12-17 13:52:44+00:00,An invaluable product which really…                                    An invaluable product which really helped me in the early days of breast feeding my twins and something I continue to rely upon most days at 6 months. The elvie team have been really helpful and got back to me promptly if I have had any problems with the devices.,2020,2020-12,5
5fdb6232755dc10b482600ee,4 stars: Great,GB,2020-12-17 13:50:42+00:00,"I do love my Elvie                                    I do love my Elvie, both electric one and the curve. But it can be slightly temperamental after putting it back together.  Do however recommend for being able to carry on with normal daily tasks and pumping too.",2020,2020-12,4
5fdb61f8755dc10b4826008f,5 stars: Excellent,GB,2020-12-17 13:49:44+00:00,Perfect customer service and product :),2020,2020-12,5
5fdb61e8755dc107e0c64da3,5 stars: Excellent,GB,2020-12-17 13:49:28+00:00,Really great product                                    Really great product. Helps keep you dry especially at night as long as you empty every 3-4 hours. Would definitely recommend,2020,2020-12,5
5fdb614b755dc107e0c64cb4,5 stars: Excellent,GB,2020-12-17 13:46:51+00:00,Elvie customer service can't fault                                    After having a few complications with my elvie pump the customer service has been amazing quick resolutions and perfect response time for something that you spend a lot of money on.Thanks elvie,2020,2020-12,5
5fdb60bf755dc107e0c64bdf,1 star: Bad,GB,2020-12-17 13:44:31+00:00,Not fit for purpose                                    The product broke after a week after my daughter scratched it and they offered me 10% off a new one. The product was not fit for purpose and my 2 year old shouldn't have been able to scratch the silicone. Its now useless and not safe to use.,2020,2020-12,1
5fdb5bfa755dc10b4825f6fd,2 stars: Poor,US,2020-12-17 13:24:10+00:00,Buyer Beware                                    The product works as intended. Unfortunately my experience was customer care team was unpleasant. My promo code was not applied to my order and I emailed immediately for them to refund me the difference. The agent wanted me to provide an email of a woman from my mommy's group who pasted the promo code. Of course she did not feel comfortable giving me her email address because I'm a stranger on the internet. It's unfortunate he could see her name and confirmed the promo should've been applied but he would not and then closed my request. I will not be ordering from this company again and I'll encourage others to beware of they intend on using a promo.,2020,2020-12,2
5fdb5378755dc107e0c6353c,1 star: Bad,GB,2020-12-17 12:47:52+00:00,"No budge on warranty                                    My pump hub stopped charging 2 years and 2 DAYS after I'd purchased it online. Customer service refused to budge on warranty of 2 years despite the fact that I'd only received it 6 days after order, so those first few days of warranty it wasn't in my possession.Disappointing and I feel as though the founders wouldn't have the same ethos, but have outsourced their customer support function to people who are simply following protocol to the letter without any commercial sense.",2020,2020-12,1
5fdb41b3755dc10b4825cae8,5 stars: Excellent,US,2020-12-17 11:32:03+00:00,"Customer Service                                    Customer Service is GREAT! I needed a replacement part, I sent an email to support and within hours it was being processed. I received my part a few days later.",2020,2020-12,5
5fdad465755dc107e0c5c5bc,5 stars: Excellent,US,2020-12-17 03:45:41+00:00,Excellent service.,2020,2020-12,5
5fdab65a755dc107e0c5bf18,4 stars: Great,US,2020-12-17 01:37:30+00:00,Fast delivery and accurate services                                    Fast delivery and accurate services. Both curve and catch are excellent,2020,2020-12,4
5fdaa7af755dc107e0c5bac7,3 stars: Average,AU,2020-12-17 00:34:55+00:00,"Address Error by Elvie                                    My pump got shipped to a combination of my billing and shipping addresses, due to an elvie clerical error. The customer service rep I spoke to took nearly a week to re-ship a pump for me because they needed approval from a certain dept. I did ultimately get my pump, but I think they should have reshipped immediately and then worried on their end about finding the lost pump since it wasn't my mistake. Not to mention I had to then have it forwarded to me because they don't yet ship to Australia. Needless to say it was very expensive and took a long time...hope it's worth it.",2020,2020-12,3
5fdaa11d755dc10b48256a7f,4 stars: Great,GB,2020-12-17 00:06:53+00:00,Excellent product- worth the £ for freedom of movement                                    Love this product- would have given 5 stars but the parts warp when you sterilise them in boiling water or steam. This should be highlighted in the instructions. It also can leak at times but if you put a bit of paper towel in between the flange and the pump it works a treat.,2020,2020-12,4
5fda9dbe755dc10b48256918,5 stars: Excellent,US,2020-12-16 23:52:30+00:00,I purchased this for my granddaughter                                    I purchased this for my granddaughter. She has since had her 2nd son. She likes the pump very much though she said I shouldn’t have spent so much.,2020,2020-12,5
5fda911a755dc10b48256264,2 stars: Poor,US,2020-12-16 22:58:34+00:00,"Always losing connection and having…                                    Always losing connection and having error message, retrieving session details failed. Otherwise, pump is good. I just can never get it to accurately record my sessions.",2020,2020-12,2
5fda909d755dc107e0c5aff2,5 stars: Excellent,US,2020-12-16 22:56:29+00:00,Elvie double pump review                                    I have been sent replacement parts multiple times for some issues I have been having with no hassle! Great customer service!,2020,2020-12,5
5fda7ff4755dc10b4825545c,5 stars: Excellent,US,2020-12-16 21:45:24+00:00,Anytime I have an issue I just call or…                                    Anytime I have an issue I just call or email and you resolve it right away.,2020,2020-12,5
5fda704f755dc10b48254406,2 stars: Poor,US,2020-12-16 20:38:39+00:00,"Hard Pass                                    i had major issues w leaking and battery charging- CS strung me on for literal weeks, only replied to my messages once a day instead of keeping up communication to solve the problem, then wanted me to go on and on running different tests to trouble shoot - mind you the reason for the pumps is the high maintenance newborn baby who needed to be fed in the midst of it all. would NOT recommend.",2020,2020-12,2
5fda6f33755dc107e0c590be,5 stars: Excellent,US,2020-12-16 20:33:55+00:00,Quick resolution when I had a product…                                    Quick resolution when I had a product issue. Would buy again if pump has newer version for next baby. Very convenient pump. Though  I wish it worked better for supply building.,2020,2020-12,5
5fda69b6755dc107e0c58a55,5 stars: Excellent,US,2020-12-16 20:10:30+00:00,easy and quick!                                    It was quick and easy to buy and then shipment came early! Wahoo!,2020,2020-12,5
5fda6702755dc10b48253989,5 stars: Excellent,US,2020-12-16 19:58:58+00:00,Great product and business                                    Just got my package today only took five minutes to figure everything out. Love that it has an app that runs you threw everything on how to take apart for cleaning. The shipping was pretty fast and thats even one week before Christmas. Im very happy with my product cant wait to start using it. Thank you for making my life easier.,2020,2020-12,5
5fda63fd755dc10b48253606,5 stars: Excellent,US,2020-12-16 19:46:05+00:00,"Wonderful experience                                    I have had two minor problems with my Elvie’s since using them for the last 4 months.  Both times I was able to email customer service and they quickly responded with guidance, and when their problem solving did not fix the problem, they were quick to send me replacement parts. I am very impressed with this company.",2020,2020-12,5
5fda6321755dc10b48253517,5 stars: Excellent,GB,2020-12-16 19:42:25+00:00,Magical helper                                    Magical helper! After 3 weeks of using it I achieved great results and my problem with urinary incontinence has been solved! During this time I had to charge it once! Highly recommend.,2020,2020-12,5
